{
	"version": 0,
	"origin": "agent-inferred",
	"space": "main",
	"agent": { "kind": "agent", "id": "local" },
	"principal": "ada",
	"session": null,
	"traceId": "c0f3a1d2e4b5968778695a4b3c2d1e0f",
	"observedAt": "2026-11-02T10:15:00.000Z",
	"validFrom": null,
	"validUntil": null,
	"confidence": 0.8,
	"authority": null
}
